{
  "contract_version": "finding-dialogue-output.v1",
  "run_id": "11111111-1111-4111-8111-111111111111",
  "dialogue_id": "90000000-0000-4000-8000-000000000001",
  "turn_id": "91000000-0000-4000-8000-000000000002",
  "assistant_message": {
    "action": "propose_resolution",
    "content": "Можно зафиксировать однозначный регламент ежедневного запуска.",
    "proposed_resolution": {
      "text": "Обновление выполняется ежедневно в 06:00 по московскому времени.",
      "rationale": "Формулировка задаёт периодичность, время и часовой пояс."
    },
    "anchors": [
      {
        "source_id": "source-main",
        "fragment_id": "source-main-lines-1-3",
        "quote": "Обновление витрины выполняется регулярно.",
        "quote_start": 0,
        "quote_end": 41
      }
    ]
  }
}
